{
	"$schema": "https://shadcn-svelte.com/schema.json",
	"style": "vega",
	"tailwind": {
		"css": "src/app.css",
		"baseColor": "neutral"
	},
	"aliases": {
		"components": "$lib/components",
		"ui": "@workspace/ui/components",
		"lib": "$lib",
		"hooks": "$lib/hooks",
		"utils": "@workspace/ui/lib/utils"
	},
	"typescript": true
}
