{
	"$schema": "https://shadcn-svelte.com/schema.json",
	"style": "vega",
	"tailwind": {
		"css": "src/lib/styles.css",
		"baseColor": "neutral"
	},
	"aliases": {
		"components": "$lib/components",
		"ui": "$lib/components/ui",
		"lib": "$lib",
		"hooks": "$lib/hooks",
		"utils": "$lib/utils"
	},
	"typescript": true
}
